{
  "$schema": "http://json-schema.org/draft-07/schema#",
  "$id": "wpd/form-state",
  "type": "object",
  "required": ["meta", "branding", "barcode", "semantics", "displayFields"],
  "additionalProperties": false,
  "properties": {
    "meta": {
      "type": "object",
      "required": ["passTypeId", "teamId", "organizationName", "serialNumber", "description"],
      "additionalProperties": false,
      "properties": {
        "passTypeId": { "type": "string" },
        "teamId": { "type": "string" },
        "organizationName": { "type": "string" },
        "serialNumber": { "type": "string" },
        "description": { "type": "string" },
        "webServiceURL": { "type": "string" },
        "authenticationToken": { "type": "string", "minLength": 16 },
        "expirationDate": { "type": "string" },
        "groupId": { "type": "string", "description": "Trip id (e.g. RP247@2026-06-01). Optional: derived from airline + flight + departure date when absent." }
      }
    },
    "branding": {
      "type": "object",
      "required": ["logoText", "foregroundColor", "backgroundColor", "labelColor"],
      "additionalProperties": false,
      "properties": {
        "logoText": { "type": "string" },
        "foregroundColor": { "type": "string", "pattern": "^rgb\\(\\d+,\\s*\\d+,\\s*\\d+\\)$" },
        "backgroundColor": { "type": "string", "pattern": "^rgb\\(\\d+,\\s*\\d+,\\s*\\d+\\)$" },
        "labelColor": { "type": "string", "pattern": "^rgb\\(\\d+,\\s*\\d+,\\s*\\d+\\)$" },
        "logoDataUrl": { "type": "string" },
        "iconDataUrl": { "type": "string" },
        "footerDataUrl": { "type": "string" },
        "primaryLogoDataUrl": { "type": "string" }
      }
    },
    "barcode": {
      "type": "object",
      "required": ["format", "message", "altText"],
      "properties": {
        "format": { "enum": ["PKBarcodeFormatQR", "PKBarcodeFormatPDF417", "PKBarcodeFormatAztec", "PKBarcodeFormatCode128"] },
        "message": { "type": "string" },
        "altText": { "type": "string" }
      }
    },
    "semantics": { "type": "object" },
    "displayFields": {
      "type": "object",
      "additionalProperties": false,
      "properties": {
        "header": { "$ref": "#/definitions/fieldList" },
        "primary": { "$ref": "#/definitions/fieldList" },
        "secondary": { "$ref": "#/definitions/fieldList" },
        "auxiliary": { "$ref": "#/definitions/fieldList" },
        "back": { "$ref": "#/definitions/fieldList" }
      }
    },
    "iOS26": {
      "type": "object",
      "additionalProperties": false,
      "properties": {
        "additionalInfoFields": {
          "type": "array",
          "items": {
            "type": "object",
            "required": ["key", "label", "value"],
            "additionalProperties": false,
            "properties": {
              "key": { "type": "string" },
              "label": { "type": "string" },
              "value": { "type": "string" },
              "timeFormat": { "enum": ["24h"] },
              "optional": { "type": "boolean" },
              "changeMessage": { "type": "string" }
            }
          }
        },
        "relevantDates": { "type": "array", "items": { "type": "string", "format": "date-time" } },
        "eventGuide": {
          "type": "object",
          "additionalProperties": false,
          "properties": {
            "bagPolicyURL": { "type": "string" },
            "orderFoodURL": { "type": "string" },
            "transferURL": { "type": "string" },
            "parkingInformationURL": { "type": "string" },
            "directionsInformationURL": { "type": "string" },
            "transitInformationURL": { "type": "string" }
          }
        },
        "upcomingPassInformation": {
          "type": "array",
          "items": {
            "type": "object",
            "required": ["identifier", "name", "date"],
            "additionalProperties": false,
            "properties": {
              "identifier": { "type": "string" },
              "name": { "type": "string" },
              "date": { "type": "string", "format": "date-time" }
            }
          }
        },
        "wifi": {
          "type": "array",
          "items": {
            "type": "object",
            "required": ["ssid"],
            "additionalProperties": false,
            "properties": {
              "ssid": { "type": "string" },
              "password": { "type": "string" }
            }
          }
        }
      }
    }
  },
  "definitions": {
    "fieldList": {
      "type": "array",
      "items": {
        "type": "object",
        "required": ["key", "label", "value"],
        "additionalProperties": false,
        "properties": {
          "key": { "type": "string" },
          "label": { "type": "string" },
          "value": { "type": "string" },
          "dateStyle": { "type": "string" },
          "timeStyle": { "type": "string" },
          "timeFormat": { "enum": ["24h"], "description": "Render the ISO value as HH:mm (its own offset) at emit instead of letting Wallet format it." },
          "optional": { "type": "boolean", "description": "Leave the field off the pass while its value is blank." },
          "changeMessage": { "type": "string" }
        }
      }
    }
  }
}
