{
  "meta": {
    "passTypeId": "pass.dev.local",
    "teamId": "DEV0000000",
    "organizationName": "Cebu Pacific Air",
    "serialNumber": "5J5056-001",
    "description": "Cebu Pacific boarding pass",
    "webServiceURL": "http://localhost:4317/api/wallet",
    "authenticationToken": "5J5056-token-0123456789abcdef"
  },
  "branding": {
    "logoText": "Cebu Pacific",
    "foregroundColor": "rgb(30,30,30)",
    "backgroundColor": "rgb(255,210,0)",
    "labelColor": "rgb(0,108,184)"
  },
  "barcode": {
    "format": "PKBarcodeFormatPDF417",
    "message": "5J5056MNLCEB12F0017",
    "altText": "5J5056 12F"
  },
  "semantics": {
    "airlineCode": "5J",
    "flightCode": "5J5056",
    "flightNumber": 5056,
    "departureAirportCode": "MNL",
    "departureAirportName": "Ninoy Aquino International",
    "departureCityName": "Manila",
    "departureLocationDescription": "Manila",
    "destinationAirportCode": "CEB",
    "destinationAirportName": "Mactan-Cebu International",
    "destinationCityName": "Cebu",
    "destinationLocationDescription": "Cebu",
    "departureTerminal": "3",
    "departureGate": "132",
    "destinationTerminal": "2",
    "departureLocationTimeZone": "Asia/Manila",
    "departureAirportTimeZone": "Asia/Manila",
    "destinationLocationTimeZone": "Asia/Manila",
    "destinationAirportTimeZone": "Asia/Manila",
    "departureLocation": {
      "latitude": 14.5086,
      "longitude": 121.0194
    },
    "destinationLocation": {
      "latitude": 10.3075,
      "longitude": 123.9788
    },
    "originalDepartureDate": "2026-06-15T06:00:00+08:00",
    "currentDepartureDate": "2026-06-15T06:00:00+08:00",
    "originalArrivalDate": "2026-06-15T07:30:00+08:00",
    "currentArrivalDate": "2026-06-15T07:30:00+08:00",
    "originalBoardingDate": "2026-06-15T05:30:00+08:00",
    "currentBoardingDate": "2026-06-15T05:30:00+08:00",
    "passengerName": {
      "givenName": "ANGELO",
      "familyName": "SOLIVERES"
    },
    "boardingGroup": "2",
    "boardingSequenceNumber": "0017",
    "seats": [
      {
        "seatRow": "12",
        "seatNumber": "F",
        "seatType": "economy"
      }
    ],
    "duration": 5400,
    "securityScreening": "OTS",
    "transitProvider": "Skybridge to Gate 132"
  },
  "displayFields": {
    "header": [
      {
        "key": "gate",
        "label": "GATE",
        "value": "132"
      },
      {
        "key": "seat",
        "label": "SEAT",
        "value": "12F"
      }
    ],
    "primary": [
      {
        "key": "depart",
        "label": "Manila",
        "value": "MNL"
      },
      {
        "key": "arrive",
        "label": "Cebu",
        "value": "CEB"
      }
    ],
    "secondary": [
      {
        "key": "passenger",
        "label": "PASSENGER",
        "value": "ANGELO SOLIVERES"
      },
      {
        "key": "flight",
        "label": "FLIGHT",
        "value": "5J5056"
      }
    ],
    "auxiliary": [
      {
        "key": "boarding",
        "label": "BOARDING",
        "value": "2026-06-15T05:30:00+08:00",
        "dateStyle": "PKDateStyleNone",
        "timeStyle": "PKDateStyleShort"
      },
      {
        "key": "depart-time",
        "label": "DEPART",
        "value": "2026-06-15T06:00:00+08:00",
        "dateStyle": "PKDateStyleNone",
        "timeStyle": "PKDateStyleShort"
      },
      {
        "key": "group",
        "label": "GROUP",
        "value": "2"
      },
      {
        "key": "seq",
        "label": "SEQ",
        "value": "0017"
      }
    ],
    "back": [
      {
        "key": "ff",
        "label": "FREQUENT FLYER",
        "value": "—"
      },
      {
        "key": "terminal-dep",
        "label": "DEPARTURE TERMINAL",
        "value": "3"
      },
      {
        "key": "terminal-arr",
        "label": "ARRIVAL TERMINAL",
        "value": "2"
      }
    ]
  },
  "iOS26": {
    "additionalInfoFields": [
      {
        "key": "fare-class",
        "label": "FARE",
        "value": "GoLite"
      },
      {
        "key": "baggage",
        "label": "BAGGAGE",
        "value": "Hand-carry only"
      }
    ],
    "relevantDates": [
      "2026-06-15T05:00:00+08:00"
    ],
    "eventGuide": {
      "bagPolicyURL": "https://www.cebupacificair.com/baggage",
      "orderFoodURL": "https://www.cebupacificair.com/cebsmiles",
      "parkingInformationURL": "https://www.miaa.gov.ph/parking",
      "transitInformationURL": "https://www.naia.aero/transit"
    },
    "upcomingPassInformation": [
      {
        "identifier": "checkin-open",
        "name": "Web check-in opens",
        "date": "2026-06-14T06:00:00+08:00"
      },
      {
        "identifier": "boarding-open",
        "name": "Boarding begins",
        "date": "2026-06-15T05:30:00+08:00"
      }
    ],
    "wifi": [
      {
        "ssid": "CebPac-WiFi",
        "password": "5J5056"
      }
    ]
  }
}
