{
  "meta": {
    "passTypeId": "pass.dev.local",
    "teamId": "DEV0000000",
    "organizationName": "Rocket Partners Airlines",
    "serialNumber": "RP-FAM-001",
    "description": "Boarding pass"
  },
  "branding": {
    "logoText": "Rocket Partners",
    "foregroundColor": "rgb(255,255,255)",
    "backgroundColor": "rgb(20,30,80)",
    "labelColor": "rgb(180,200,255)"
  },
  "barcode": {
    "format": "PKBarcodeFormatQR",
    "message": "RP247-SFOJFK-FAM-0044",
    "altText": "RP247 14A/B/C"
  },
  "semantics": {
    "airlineCode": "RP",
    "flightCode": "RP247",
    "flightNumber": 247,
    "departureAirportCode": "SFO",
    "departureAirportName": "San Francisco Intl",
    "departureCityName": "San Francisco",
    "departureLocationDescription": "San Francisco",
    "destinationAirportCode": "JFK",
    "destinationAirportName": "John F. Kennedy Intl",
    "destinationCityName": "New York",
    "destinationLocationDescription": "New York",
    "departureTerminal": "2",
    "departureGate": "B12",
    "destinationTerminal": "4",
    "originalDepartureDate": "2026-06-01T08:15:00-07:00",
    "currentDepartureDate": "2026-06-01T08:15:00-07:00",
    "originalArrivalDate": "2026-06-01T16:45:00-04:00",
    "currentArrivalDate": "2026-06-01T16:45:00-04:00",
    "originalBoardingDate": "2026-06-01T07:30:00-07:00",
    "currentBoardingDate": "2026-06-01T07:30:00-07:00",
    "passengerName": {
      "givenName": "FAMILY",
      "familyName": "SOLIVERES"
    },
    "boardingGroup": "3",
    "boardingSequenceNumber": "0044",
    "seats": [
      {
        "seatRow": "14",
        "seatNumber": "A",
        "seatType": "economy"
      },
      {
        "seatRow": "14",
        "seatNumber": "B",
        "seatType": "economy"
      },
      {
        "seatRow": "14",
        "seatNumber": "C",
        "seatType": "economy"
      }
    ]
  },
  "displayFields": {
    "header": [
      {
        "key": "gate",
        "label": "GATE",
        "value": "B12"
      },
      {
        "key": "seat",
        "label": "SEAT",
        "value": "14A,14B,14C"
      }
    ],
    "primary": [
      {
        "key": "depart",
        "label": "San Francisco",
        "value": "SFO"
      },
      {
        "key": "arrive",
        "label": "New York",
        "value": "JFK"
      }
    ],
    "secondary": [
      {
        "key": "passenger",
        "label": "PASSENGER",
        "value": "FAMILY SOLIVERES"
      },
      {
        "key": "flight",
        "label": "FLIGHT",
        "value": "RP247"
      }
    ],
    "auxiliary": [
      {
        "key": "boarding",
        "label": "BOARDING",
        "value": "2026-06-01T07:30:00-07:00",
        "dateStyle": "PKDateStyleNone",
        "timeStyle": "PKDateStyleShort"
      },
      {
        "key": "depart-time",
        "label": "DEPART",
        "value": "2026-06-01T08:15:00-07:00",
        "dateStyle": "PKDateStyleNone",
        "timeStyle": "PKDateStyleShort"
      },
      {
        "key": "group",
        "label": "GROUP",
        "value": "3"
      },
      {
        "key": "seq",
        "label": "SEQ",
        "value": "0044"
      }
    ],
    "back": [
      {
        "key": "ff",
        "label": "FREQUENT FLYER",
        "value": "—"
      },
      {
        "key": "terminal-dep",
        "label": "DEPARTURE TERMINAL",
        "value": "2"
      },
      {
        "key": "terminal-arr",
        "label": "ARRIVAL TERMINAL",
        "value": "4"
      }
    ]
  }
}
